likes,body,time191,"В первые годы своего президентства Путин выступал категорически против любых изменений в Конституцию — и с ней ничего не происходило. Однако со временем его позиция стала меняться — а вслед за этим и Основной закон, даже если формально инициатором выступал не сам Путин.",1579475495
114,"Автор текста песни «Зола» Александр Вулых подтвердил в комментарии РБК, что музыку для Лепса, в том числе и «Настоящую женщину», действительно сочинил глава ФНС Михаил Мишустин. По словам Вулых, для Мишустина музыка — это хобби, которое тот предпочитает не афишировать.",1579473095
276,"Обратившись к Федеральному собранию, Владимир Путин анонсировал радикальную конституционную реформу. Она направлена на расширение роли Госсовета (который сейчас вообще не фигурирует в Конституции), парламента и премьер-министра. Роль самого Путина в будущей конфигурации власти пока не ясна — но, скорее всего, она будет напоминать место Нурсултана Назарбаева в современном Казахстане.",1579470695
122,"ОРВИ — довольно распространенное заболевание. И как любая популярная болезнь, она окружена многочисленными мифами. «Медуза» предлагает читателям проверить, что они знают об ОРВИ и умеют ли отличать правду от вымысла.",1579468295
100,"В декабре 2019 года в китайском городе Ухань зафиксировали вспышку пневмонии с неизвестным возбудителем. 31 декабря китайские власти сообщили о 44 пациентах, у 11 из них состояние было тяжелым. 9 января один из пациентов умер, однако у него были опухоли в брюшной полости и хроническая болезнь печени, поэтому точная причина смерти в действительности неизвестна.",1579465895
95,"16 января новым премьер-министром России стал Михаил Мишустин. Не позднее вторника премьер должен сформировать новое правительство. «Медуза» предлагает вам не ждать его решения, а раздать ключевые министерские посты самостоятельно. Кто будет новым министром культуры — BadComedian или Мединский? А министром просвещения? Может, рэпер Фейс?",1579463495
145,"«Медуза» поговорила с руководителем международной практики правозащитной группы «Агора» Кириллом Коротеевым о том, почему Россия все равно будет подчиняться международным судам, но гражданам страны станет тяжелее защитить свои права.",1579461095
184,В районе месторождения также расположена американская военная база,1579458695
146,"Традиционное шествие памяти адвоката Станислава Маркелова и журналистки «Новой газеты» Анастасии Бабуровой в этом году получилось не совсем традиционным. Людей было куда больше, а многие участники шествия пришли на него, держа в руках Конституцию - чтобы защитить ее от Владимира Путина.",1579456038
273,"""Мочить"" критикующих власть журналистов и блогеров означает вовсе не то, что вы все сразу подумали! Занимательные уроки русского языка от пресс-службы главы Чувашии",1579451943
206,"SpaceX испытала систему аварийного спасения пилотируемого корабля Crew Dragon (да, они взорвали фалькон!)",1579448365
87,"Посмотрите на Артура Лишь: чинно восседает на островном диване посреди вестибюля отеля в синем костюме и белой рубашке, нога закинута на ногу, на мыске болтается полированный лофер. У писателя профиль патриция с длинным носом, который неизменно обгорает, На коленях у него шлем от российского космического скафандра.",1579445789
68,Систему распознавания лиц полицейским департаментам продают за две тысячи долларов,1579443389
147,На согласованном антифашистском шествии в Москве начался винтаж,1579439303
406,"Когда зритель замечает наличие сверхъестественного зла, драматургия сериала меняется причудливым образом. Из чрезвычайно серьезного психологического триллера с элитарного телеканала он превращается в старомодный — по-своему даже проходной — эпизод народных «Секретных материалов», огорчен кинокритик Егор Москвитин.",1579436692
134,"История актера, который превратил образ мужчины в платье в серьезное высказывание.",1579434292
220,"Принца Гарри и его жену Меган Маркл лишили королевских титулов и ежегодных выплат части от 82 миллионов фунтов стерлингов, которые из бюджета выделяют королевской семье. А еще они вернут 2,4 миллиона фунтов стерлингов за ремонт резиденции",1579431892
117,"Помните, был такой премьер-министр Медведев?",1579429492
152,"Музыкант впал в кому после нападения в июне 2019-го, он умер не приходя в сознание",1579428275
459,"«Маяк» Роберта Эггерса - в российском прокате. Антон Долин еще в прошлом мае объяснил, почему на него стоит сходить",1579427098
271,Глава Чувашии своеобразно поздравил журналистов с профессиональным праздником,1579424698
323,"Слышите крики о помощи из соседней квартиры, заметили, что на кого-то кричат в публичном месте, видите человека, которого избивают на улице? Рассказываем, как помочь человеку, который (возможно) столкнулся с насилием - вместе с «ИНГО. Кризисный центр для женщин» в Санкт-Петербурге.",1579422298
146,Опцию уже можно отключить в бета-версии iOS 13.3.1,1579419897
661,Летом российского режиссера включили в состав Американской киноакадемии. А исполнительница главной роли в его фильме «Айка» получила получила приз за лучшую женскую роль в Каннах - и это далеко не единственная награда фильма. Однако теперь из-за этой картины Минкульт требует от Дворцевого семь миллионов рублей. Режиссер разорен.,1579417498
120,Ирландец Конор Макгрегор победил американца Дональда Серроне на турнире UFC 246; это первый бой Макгрегора после проигрыша россиянину Хабибу Нурмагомедову в октябре 2018-го,1579415097
120,"Прошел месяц с нападения на штаб-квартиру ФСБ на Лубянке. Дело расследует генерал-майор юстиции Улади Уладиев. Ему, в частности, предстоит выяснить, кто именно убил одного из сотрудников ФСБ — уже после того, как погиб нападавший Евгений Манюров.",1579410235
61,"Гарантированный пенсионный план придумали Минфин и Центробанк. Пока, кажется, можно расслабиться: во-первых, законопроект еще даже не внесли в Госдуму, а во-вторых, новая реформа касается негосударственных пенсий, и все отчисления добровольны.

Но узнать подробности заранее не помешает:",1579406635
148,"Возможно, во время новогодних праздников у вас возникала эта тревожная мысль. Эти карточки рассказывают, как определить признаки алкогольной зависимости:",1579403035
51,"Неделя выдалась такой, что вы легко могли пропустить премьеру нашего подкаста «Ты же мать». В общем, теперь у нас представлен и женский взгляд на родительство",1579399435
111,"18 января 1926 года состоялся первый публичный показ фильма Сергея Эйзенштейна «Броненосец „Потемкин“» — вряд ли он нуждается в представлении. 

Предлагаем вам почитать главу из книги британского историка Майка ОʼМахоуни, которая рассказывает о том, как шла работа над картиной, и о том, как ее приняли зрители. 

Это материал 2016 года.",1579395835
193,"«Я еще работал в Англии и приехал в отпуск в Волгоград. Пошел на рынок, купил, что собирался, направляюсь к выходу и вижу — идет довольно пожилая женщина. Я открыл дверь, стою жду, когда она преодолеет остаток пути. Она шла медленно, не ускорилась ни на миллиметр. И она вот проходит, смотрит на меня скептически, подбирает слова: «Ну как вот тебя назвать?» Я предлагаю: «Может быть, джентльмен?» Она такая: «Ну какой ты на хер джентльмен?» И пошла дальше. У меня был культурологический шок — и просто слезы от смеха»

Тренер Леонид Слуцкий возвращается работать в Россию — и рассказывает о трех годах работы за рубежом:",1579392235
311,"Впервые с 2012 года премьер-министра России зовут не Дмитрий Медведев. У семьи Михаила Мишустина уже успели найти недвижимость на полтора миллиарда рублей и загадочный бизнес, на котором его жена заработала почти 800 миллионов за 9 лет.

Вот что известно о самом Мишустине и о его прошлом:",1579388635
284,"«Я бы назвал то, что произошло, не конституционным переворотом, а революцией сверху. Революция сверху — это старая русская традиция. Можно привести множество примеров и из царского, и из советского времени. То у нас „год великого перелома“, то „головокружение от успехов“, а то вдруг „безродные космополиты“. 

Сталин был мастером этой игры — взять и заявить какую-нибудь новую генеральную линию. И вот все уже ходят по струнке, и никто не угрожает вождю. Сталин боялся заговоров, хотя ни одного настоящего заговора против него науке найти не удалось. В этом смысле Путин как Сталин, но только в этом. Во всем остальном — нет. Он не Сталин, а Россия — не Советский Союз»

Максим Трудолюбов, Борис Макаренко, Александр Баунов, Владимир Мазаев и Елена Лукьянова рассуждают о том, можно ли считать предложенные Путиным поправки к Конституции «конституционным переворотом»",1579385035
174,Загадочных дарителей не могли найти шесть лет — и в конечном итоге они раскрыли себя сами.,1579381435
191,"В ночь с 18 на 19 января отмечается праздник Крещения. С крещенскими морозами в этом году как-то не задалось, а вот в XIX и XX веках морозы были как надо. В своих дневниках о них писали император Николай II, Лев Толстой и его дочь, и простые крестьяне и школьники. 
Это материал 2015 года. ",1579377835
154,В последние годы ко Дню победы ветеранам выплачивали по 10 тысяч,1579375435
89,Азария был голосом Апу с самого первого появления персонажа в сериале в 1990 году.,1579373035
101,Дочь бывшего президента Анголы обвиняют в выводе миллиарда долларов из госкомпаний и попытке перевести бизнес в Россию,1579370633
243,"Слежка за Анастасией Шевченко велась в рамках уголовного дела об участии в деятельности нежелательной организации, фигурантом которого она является",1579368233
133,"Прямо сейчас, по данным Forbes, Арно богаче Безоса на 1,4 миллиарда долларов",1579365833
262,"Сегодня журналист Илья Азар и другие неравнодушные вышли в 12 часов дня к Администрации Президента с одиночными пикетами против внесения правок в Конституцию. Протестующие рассказали, с чем они не согласны и почему важно говорить о своей гражданской позиции.
На пикете полиция забрала представительницу националистической политической группы SERB, нападавшую на людей с плакатами.",1579363433
90,"«Не надо охотиться за идиллическими красотами и редкой фауной там, где человеческая жизнь от начала до конца проистекает за чертой бедности. Не надо увлекательных путешествий в голодный край. Если уж ездить в такие места, то только с тем, чтобы попытаться что-то сделать», — Галина Юзефович рассказывает о «Африканской книге» нью-йоркского врача-онколога, прозаика и поэта Александра Стесина.",1579361033
137,"Лиза Киселева, утверждает автор письма в прокуратуру, «убита однозначно из-за преступной беспечности матери, которая не удосужилась за руку проводить и встретить свою дочь».",1579358633
87,"Из знаменитого логотипа слово Fox тоже уберут, но в остальном он останется неизменным",1579356233
59,"Ожидается, что новый состав правительства Михаил Мишустин объявит не позднее вторника. В него могут не попасть, в частности, вице-премьеры Ольга Голодец и Константин Чуйченко",1579353833
63,"Для тех, кто пропустил нашу премьеру из-за многочисленных новостей. У нас новый подкаст о родительстве — теперь от лица матерей. Он называется «Ты же мать», и его ведут три женщины — журналистки Настя Красильникова и Анастасия Хартулари, а такжепреподаватель РГГУ Александра Довлатова.
В первом выпуске ведущие обсуждают, сложно ли решиться на рождение ребенка (тем более на трех, как у Саши) и почему материнство совсем не похоже на красивые картинки из журналов. А еще — советуются, как лучше бороться с непрошеными советами и меньше тревожиться, ведь поводов для этого после рождения ребенка предостаточно.",1579351433
97,"Никто из 185 человек, находившихся на борту, не пострадал",1579349033
512,"Каждому гражданину в реестре будет присвоен уникальный идентификатор, к которому будут привязаны все прочие - от ИНН до номера пенсионного страхования. Его никто не сможет поменять, даже если человек уедет в другой регион или страну и сменит фамилию и имя.",1579346633
114,"Всего в ходе ICO Telegram смог привлечь 1,7 миллиарда долларов. Как заявил Дуров, на развитие мессенджера и блокчейн-платформы TON только за 2018 год были потрачены 218 миллионов, из которых 89 миллионов ушло на оплату оборудования и серверов",1579344233
96,"Антон Долин рассказывает, что смотреть в кино на этих выходных: триллер с Робертом Паттинсоном и Уиллемом Дефо «Маяк», фильм «Особенные» с Венсаном Касселем, антиутопию Пон Чжун Хо 2013 года «Сквозь снег» и фильм о женщине-космонавте с Евой Грин — «Проксима»",1579341814
770,"Высшая школа экономики — один из крупнейших и (без скидок) лучших вузов страны. В последние месяцы ее студенты и преподаватели часто становились героями новостей из-за своих высказываний и действий, в том числе политических. Кажется, руководству университета это надоело: администрация предложила поправки во внутренние правила, которые вводят ограничения для студентов и преподавателей на общественную и политическую деятельность",1579340092
67,"Ранее предполагалось переписать софт только для системы MCAS, некорректная работа которой привела к двум авиакатастрофам",1579337692
88,Изменения вступят в силу 17 февраля,1579335292
101,"«Я искренне хочу вас поблагодарить за службу Отечеству, работу в правительстве Российской Федерации»

Новый премьер встретился с Дмитрием Медведевым и министрами",1579332892
95,"Дело бывшего инспектора отдела безопасности ярославской колонии № 1 Максима Яблокова рассматривалось в особом порядке, так как он признал свою вину.",1579330492
171,"Вспышка пневмонии, вызванной неизвестным возбудителем, началась в городе Ухань в конце декабря. С тех пор был зафиксирован 41 подтвержденный случай заражения. Двое умерли.",1579326892
78,"Джимми Флетчера Медерса осудили за убийство сотрудника круглосуточного магазина Дона Андерсона еще в 1989 году. Медерса должны были казнить вечером 16 января, но отменили казнь и заменили смертный приговор на пожизненное заключение без права на условно-досрочное освобождение. ",1579323292
73,Теперь идентифицированные клиенты сервиса смогут принимать переводы с банковских карт и счетов на электронные кошельки через СБП — без комиссии со стороны «Яндекс.Денег»,1579319692
117,"По данным следствия, «бог Кузя» и его соучастники «под предлогом совершения обрядов и сбора пожертвований на строительство храмов похищали у потерпевших денежные средства мошенническим путем»",1579316092
47,"Бывшего директора ФБР Джеймса Коми проверяют на причастность к утечке секретной информации из-за документа якобы российской разведки, который США передали голландские хакеры. Он был секретным, но о нем узнали журналисты",1579312492
