likes,body,time87,Ночью 28 мая 2019 года 31-летний гражданин России пытался ввезти в Белоруссию 14 килограммов наркотиков через польско-белорусскую границу. Наркотики он спрятал в порогах и бампере своего автомобиля,1579045277
57,"Обновление: командующий Ливийской национальной армией Халифа Хафтар попросил двое суток перед подписанием договора, чтобы обсудить документ с лидерами поддерживающих его племен",1579042876
125,"За один миллиард РЖД купит 15 тысяч компьютеров. В стоимость также включены мониторы с диагональю не менее 23,8 дюйма.",1579041076
69,"Так, два жителя Хамовников рассказли «Коммерсанту», что подали заявления о продлении парковки 11 декабря и должны были получить разрешение через шесть дней. Но получили только 9 января.",1579039276
48,"Даже без бонусов за возвращение в эксплуатацию самолетов новый глава Boeing Дэвид Калхун будет получать 1,4 миллиона долларов в год",1579037476
158,Пока никто не взял на себя ответственность за инцидент,1579035676
71,Деятельность партии «Гражданская инициатива» Дмитрия Гудкова приостановлена на три месяца по решению Верховного суда. От этой партии в 2018 году Ксения Собчак баллотировалась на пост президента России.,1579033876
118,"«Теперь чертова Lion Air просит симулятор, чтобы летать на MAX — возможно, из-за собственной глупости. Я на стенку лезу, пытаясь понять, как это разрулить, идиоты», — жаловался своему коллеге один из сотрудников Boeing в 2017 году. В переобучении производитель самолетов отказал, а через год лайнер Lion Air потерпел катастрофу, в которой погибли 189 человек",1579032076
91,"Королева Елизавета II хочет добиться окончательных решений о будущем герцога и герцогини Сассекских уже в ближайшие дни, но пока планы Гарри и Меган оставляют много вопросов. ",1579030276
127,"В ноябре Минкульт отказался выдать прокатное удостоверение четырем из десяти эпизодов «Дау», сославшись на пропаганду порнографии. Илья Хржановский обратился к главе ведомства Владимиру Мединскому с просьбой разрешить прокат всех частей «Дау». Это не помогло, и теперь создатели фильма планируют судиться с Минкультом. ",1579026669
254,От завтрашнего послания президента скрыться будет еще сложнее чем обычно,1579024869
141,Со временем число противников длинных новогодних каникул только росло: в 2005 году против них выступали всего 27% респондентов,1579023069
231,Билли Айлиш станет самым молодым исполнителем саундтрека к фильму об агенте 007 за всю историю франшизы,1579021269
119,"Правительство Великобритании тайно финансировало новостное агентство Reuters в 60-х и 70-х годах по заданию отдела МИДа, отвечавшего за антисоветскую пропаганду и связанного с британской разведкой. Все это стало известно из исторических документов, рассекреченных британским МИДом. Как пишет «Би-би-си», британские дипломаты на Ближнем Востоке были обеспокоены влиянием «враждебных или полувраждебных агентств»: египетского Middle East News Agency, советского ТАСС и даже французского Agence France-Presse. В свою очередь, Reuters испытывало финансовые трудности и нуждалось в субсидиях, чтобы открыть новый офис. Представитель Reuters, комментируя новости, заявил, что сейчас бы они так не поступили и денег не взяли. ",1579019469
80,"Минфин и Центробанк разработали законопроект, который может ввести в России новую пенсионную схему — гарантированный пенсионный план. Он будет касаться только негосударственных пенсий: каждый человек сможет сам решить, готов ли он в этом участвовать, а все отчисления будут абсолютно добровольными. Их даже можно будет забрать назад — но есть тонкости. Тут подробнее о том, как все устроено: ",1579017669
227,Не повторяйте это дома,1579015869
95,У пользователей «Яндекс.Карт» в европейской части России возникли проблемы с сервисом: с карт пропал транспорт.  ,1579014069
61,"У нас хорошие новости!

21 января стартует второй сезон подкаста «Перемотка», который мы теперь делаем совместно с «Арзамасом».

Подкаст рассказывает о разных эпизодах истории России через пленки из семейных архивов — есть даже воспоминания живого очевидца революции 1917 года!

Пока можно послушать трейлер:",1579012269
147,"В ноябре ФБК выпустил расследование о недвижимости прокурора Москвы Дениса Попова. По оценкам фонда, стоимость недвижимости составила 3 миллиона евро, Попов ее не задекларировал. 

Генпрокуратура не нашла нарушений в декларациях Попова.",1579010469
209,"Вау, добрая история так и осталась доброй историей",1579008669
106,Постоянная рубрика «Как дела у королевской семьи?»,1579006866
368,❗️Журналист «Медузы» Иван Голунов признан потерпевшим по делу о превышении должностных полномочий сотрудниками полиции. Об этом ему сообщил следователь СК и пригласил на допрос 20 января.,1579004996
171,"13 ноября 2015 года террористы «Исламского государства» устроили серию терактов в Париже — в том числе, в концертном зале «Батаклан». Всего погибли 130 человек, 90 из них в «Батаклане».

9 января во Франции вышла книга «Нам еще есть, что сказать». Она написана в форме диалогов между Аздином Амимуром, отцом одного из террористов, и Жоржем Салинесом, отцом одной из погибших.

Салинес пытается понять, как мусульман убеждают в необходимости убивать других и жертвовать собой. Для Амимура, который никогда не обсуждал теракт с женой, книга стала возможностью поговорить о том, как его сын стал террористом, и есть ли в этом его вина.",1579003642
87,"Суд в США обязал Telegram предоставить банковские документы о расходовании 1,7 миллиарда долларов, полученных от инвесторов на создание блокчейн-платформы TON",1579001842
148,Пицца с ананасами — прошлый век. Настало время пиццы с киви,1579000042
92,"ЕСПЧ признал, что право Михаила Ходорковского и Платона Лебедева на справедливое судебное разбирательство было нарушено. Но само дело считать политическим отказался.",1578998242
119,"Лекарства за счет государства могут получать дети до трех лет, люди с сахарным диабетом, бронхиальной астмой, гепатитами B и С.

«Медуза» рассказывает, на какие законы опираться и куда обращаться, если вы имеете право получать лекарства бесплатно.",1578996442
52,Новый тренер «Барсы» — Кике Сетьен из «Бетиса».,1578994642
235,"Глава Счетной палаты Алексей Кудрин оценил объемы коррупции в России в триллионы рублей и заявил, что ее уровень не снижается",1578992842
77,"❗️В Иране задержали несколько человек, предположительно причастных к ситуации со сбитым украинским «боингом»",1578990572
92,"В 2020 году жюри Каннского кинофестиваля возглавит американский кинорежиссер Спайк Ли. Он станет первым темнокожим человеком, занявшим этот пост за более чем 70-летнюю историю фестиваля",1578988852
89,"Как отмечает РБК, число отказов выросло из-за скромной динамики доходов населения, а также из-за политики Центробанка, который последнее время неоднократно предупреждал о росте рисков в сегменте розничного кредитования и кредитной нагрузки на россиян.",1578987052
139,"Генерал Улади Уладиев возглавил расследование дела о стрельбе на Лубянке.

Помимо прочего, он расследовал дела о гибели 14 детей на карельском Сямозере и нападениях на наркоторговцев, которыми занимался националист Тесак.

Теперь ему предстоит выяснить, почему один из погибших сотрудников ФСБ был убит уже после того, как погиб нападавший",1578985252
501,Выглядит максимально пугающе и еще более красиво,1578982574
131,"Посольство России в ЦАР официально сообщило, что одежда была уничтожена местными правоохранительными органами без согласования с российской стороной",1578978974
113,"Джаред Лето сыграл вампира-антигероя из комиксов о Человеке-пауке. P.S. Угадайте, что за злодей из недавних фильмов с Томом Холландом появляется в конце трейлера",1578975374
147,МВД требует от Мархаева опровергнуть свое заявление о «противоправных действиях» полиции во время разгона митингов прямо во время заседания Совфеда,1578971774
50,"Первеза Мушаррафа обвиняли в госизмене. Коллегия специального суда в Лахоре посчитала, что уголовное дело не было подготовлено в соответствии с законом.",1578968174
664,"«Отряд мой будет идти мирным путем. И вся Россия будет идти мирным путем. Для вот этих перемен, чтобы демон был изгнан мирными методами»",1578964574
200,"Суд постановил, что Handelsbanken, Nordea, Yrityspankki Oyj (ОР) и Danske Bank не нарушали условий контракта, а из-за санкций против Ротенберга банки подвергаются рискам в случае проведения его платежей",1578960974
99,Кто вообще захочет бить малыша Йоду!,1578957374
200,"Японский миллиардер Юсаку Маэдзава, который станет первым космическим туристом компании SpaceX, объявил о поиске спутницы для путешествия к Луне.

Знакомство и выбор женщины пройдут в эфире специального реалити-шоу.",1578954974
147,За последний месяц компания подорожала на 20% на фоне начала поставок автомобилей покупателям в Китае,1578952574
66,Кокорин пока не зарегистрирован для участия в чемпионате России по футболу. Клуб сможет сделать это начиная с 22 января,1578950174
201,"Ни один из регионов России не смог снизить число мест концентрации ДТП на дорогах, как того требует нацпроект «Безопасные и качественные дороги». Но власти нашли выход.",1578947774
87,"По мнению экспертов, публичные высказывания Бенедикта ставят под сомнение саму модель, при которой ушедший на покой папа сохраняет формальный статус понтифика, не исполняя связанных с этим обязанностей",1578945974
133,"Британские офшорные территории — острова Мэн, Гернси и Джерси — включили Россию в число стран, с которыми проводится автоматический обмен информацией о счетах",1578944174
170,Главной героиней нового сериала станет агент ФБР Кларисса Старлинг,1578942373
84,Президент Абхазии все же сложил полномочия после протестов. Новые выборы пройдут в марте 2020. До этого времени исполнять обязанности главы республики будет премьер-министр Валерий Бганба.,1578940573
124,"Кинокритик «Медузы» Антон Долин рассказывает, какой будет борьба за премию «Оскар» в 2020 году.",1578938773
111,"Джаред Лето сыграл вампира-антигероя из комиксов о Человеке-пауке. P.S. Угадайте, что за злодей из недавних фильмов с Томом Холландом появляется в конце трейлера",1578936973
126,"«Хотя мы бы предпочли, чтобы они оставались полноценными членами королевской семьи, мы уважаем и понимаем их желание жить более независимой жизнью»",1578936685
143,Это одна из ответных мер Ирана на убийство генерала Сулеймани,1578934885
78,"По данным источников «Коммерсанта» на рынке авиаперевозок, пилоты уходят на фоне задержек зарплат, начавшихся в ноябре 2019 года",1578933085
103,"KD Studios получила от государства 52 миллиона рублей на три фильма, включая «Эбигейл» и «За гранью реальности». 

В базе выделенные средства отнесены к категории «безвозвратных». Все три фильма в прокате не окупились.",1578931285
110,🌋⚡,1578929485
93,"Директор по продукту World of Tanks Вячеслав Макаров, который собирается создать политическую партию, решил уволиться из компании Wargaming. Обещает, что «с Танками все будет хорошо»",1578927685
657,Выглядит максимально пугающе и еще более максимально красиво,1578925960
119,"К сожалению, «Дылда» Кантемира Балагова, выдвинутая на «Оскар» от России, в финальный список претендентов на кинопремию не вошла",1578924085
95,"9 января в Москве напали на Светлану Хананашвили — жену муниципального депутата Михаила Хананашвили. Ее ударили ножом не меньше шести раз. По словам депутата, на его жену уже нападали осенью 2018 года. Он затруднился назвать предполагаемые мотивы покушений.

По подозрению в нападении задержали трех человек, в том числе Василису Маслову, директора частной школы «Русский Гарвард». По версии следствия, у нее был роман с Хананашвили, и она решила убить его жену из ревности",1578923207
208,"СК возбудил уголовное дело в отношении полицейских, проводивших задержание журналиста «Медузы» Ивана Голунова",1578921407
98,"У нас готовится премьера еще одного подкаста! Он называется «Ты же мать» (чему он посвящен, кажется и так понятно).

Ведущие — филолог Александра Довлатова, журналистки Настя Красильникова и Анастасия Хартулари.

Первый выпуск выйдет уже в среду, а пока можно послушать трейлер и подписаться, чтобы не пропустить.",1578921062
83,"Блогер Владимир Корнев якобы отправил нескольким священникам СМС, чтобы, как пишут авторы «предостережения», «выведать нечто» о декабрьском съезде священнослужителей.",1578919262
57,"Сотрудник Amnesty International Олег Козловский пожаловался в ЕСПЧ из-за взлома своего аккаунта в Telegram в апреле 2016 года. После взлома он просил Следственный комитет возбудить дело, но ему отказали ",1578917462
73,👀,1578915662
261,Ох,1578913862
105,"Можно ли считать творчество нейросетей искусством или это набор штампов?С одной стороны, программа и правда подражает человеку. Но с другой — любое творчество вдохновлено чем-то более ранним. Эксперт по нейросетям объясняет, как это устроено.

Это партнерский материал",1578912062
117,"«Яндекс» собирается протестировать каршеринг с электрокарами в ряде европейских городов. Рассматриваются, в частности, Мадрид и Копенгаген.  ",1578910262
71,"При этом в старых границах города в 2019-м ввели всего 1,1 миллиона квадратных метров жилья. Рекорд получился из-за присоединения Новой Москвы в 2012 году.",1578908462
199,"Бывший главный редактор «Ведомостей» Татьяна Лысова присоединилась к «Медузе». Она стала первым заместителем главного редактора и возглавит московское бюро.

Это важнейшая новость для нашей редакции и трансфер года для российского медийного рынка, и вот почему:",1578906662
134,"Тренер Леонид Слуцкий работал в ЦСКА, возглавлял сборную России, а потом уехал в Европу: сначала в английский «Халл Сити» (и в 44 года начал с нуля учить язык), а затем в голландский «Витесс». Сейчас он возвращается в Россию — в казанский «Рубин».

Мы поговорили со Слуцким о трех годах, проведенных за рубежом и том, как они изменили его; о российском футболе и о тезке-депутате Госдумы, с которым Слуцкого-тренера продолжают путать.",1578906040
51,"Наша кровь тоже может «заболеть», но определить это непросто — чаще всего такие заболевания проходят без симптомов. О том, как кровь «заболевает» и как ее лечат — в новом эпизоде партнерского подкаста «Истории болезни».",1578904240
81,"Законопроект получил отрицательный отзыв, потому что его требования сформулированы слишком широко, и их можно распространять не только на сервисы электронной почты, но и на любые сервисы, позволяющие пользователям обмениваться сообщениями — в том числе на соцсети или чаты.",1578902440
542,"63% участников опроса заявили, что новый год будет лучше предыдущего.",1578900640
151,Новый сезон выйдет 15 марта 2020 года.,1578898839
147,Операторы связи «Мегафон» и «Билайн» повышают стоимость архивных тарифов. Одна из причин — необходимость выполнять требования российских законов,1578896300
