likes,body,time122,"В Telegram заявили, что платформа будет денецентрализованной благодаря открытому и общедоступному коду, а после запуска компания «займет ту же позицию, что и любая другая сторона»",1578339993
261,"Максимально подробное обсуждение феномена бедности с научной точки зрения, из которого вы узнаете, что россияне, к примеру, не такие уж и бедные (как обычно, все намного сложнее)",1578336393
299,"В комиссии Госдумы по этике в ответ на просьбу прокомментировать действия Жириновского, заявили, что на работе «сейчас никого нет», и обсудить поведение лидера ЛДПР комиссия сможет только после 13 января",1578332792
171,"О том, что срочник покинул место службы, стало известно 4 января. В Минобороны заявили, что причиной своего поступка солдат назвал желание навестить мать, которая недавно перенесла инсульт.",1578329192
135,Власти Ирака начали подготовку к выводу иностранных войск со своей территории,1578325592
116,2010-е годы оказались золотым десятилетием для журналистов-расследователей: их инструментами впервые стали огромные массивы данных - от оффшорной бухгалтерии до селфи в соцсетях. А объектами их разоблачений пришлось стать самым влиятельным людям планеты.,1578321992
96,"Причиной отзыва стал дефект люка на крыше: его уплотнительный материал со временем может приходить в негодность, из-за чего люк может оторваться на ходу",1578317509
126,Говорить «крайний» вместо «последний» - это рофл или беспредел?,1578315109
739,"За каких-то десять лет Россия запретила своим гражданам столько всего, что этот список занимает несколько страниц. Появилась даже ответственность за неуважительные рассуждения о победе на Чудском озере",1578312709
492,"«Недостойным правлением» называют общественный порядок, цель которого – извлечение ренты правящими группами и связанным с ними лицами. Проще говоря, государством управляют для того, чтобы расхищать его ресурсы как можно больше и как можно дольше. Ничего не напоминает? Политолог Владимир Гельман считает, что в 2010-х в Росси окончательно установился именно такой режим — и сомневается, что в ближайшее время с ним удастся что-то сделать. Но надежда есть - и это нынешние 20-летние россияне.",1578310309
123,"Меркель и Путин обсудят «актуальные темы международной повестки дня», в том числе Сирия, Ливия и обострение отношений между США и Ираном",1578307909
51,Устали от праздников? Тяжеловато есть и не делать ничего? Предлагаем размяться и порешать головоломки. Это партнерский материал.,1578305509
783,"Пока ""Первый канал"" показывал вчерашний матч в прямом эфире (он был проигран 3:4), ""Матч ТВ"" крутил запись финала Россия - Канада 2011 года.",1578303109
110,"Инвесторы опасаются, что Тегеран может перекрыть Ормузский пролив, что затруднит поставки нефти из Персидского залива, или атаковать нефтяные объекты Саудовской Аравии",1578300709
266,"Как так вышло, что вся планета теперь одевается как американские туристы среднего возраста, в модных кофейнях в разных концах Земли все сидят за одинаковыми деревянными столами, а отличаемся мы теперь крутизной кроссовок и масками в инстаграме",1578298309
183,"Трамп также пообещал, что если Ирак будет требовать вывода войск «в недружелюбной манере», США наложат на Багдад санкции",1578295081
302,"Хоакин Феникс получил награду как лучший драматический актер, «Чернобыль» назван лучшим драматическим сериалом",1578291394
136,"Миллениалы придумали конфликт поколений

#медуза2019",1578278732
182,"Если фразы «Скинь мяч!», «Меня родаки загонят» и «Вынеси попить» для вас не пустой звук, то эта игра вам точно понравится.

#медуза2019",1578275132
478,"Один из самых интересных выпусков первого сезона подкаста «Розенталь и Гильденстерн» — пожалуй, его даже можно назвать ультимативным. Из него вы узнаете, что Кирилл и Мефодий не изобретали кириллицу (шок!) — и, например, чем отличаются праславянский, старославянский и церковнославянский языки.

#медуза2019",1578271532
89,"Спецкор «Медузы» Саша Сулим увлекательно рассказывает не только о серийных убийцах, но и о героях поп-культуры. Например, о ставшей в последние годы вездесущей Ольге Бузовой (хотя стоит признать, что в 2019 году хита уровня «Мало половин» она не выпустила). 

В тексте, среди прочего, в роли эксперта (весьма неожиданно) выступает Надежда Толоконникова из Pussy Riot — заодно комментируя концерты Елены Темниковой и «просто суперкотят» из группы «Винтаж».

#медуза2019",1578267932
800,"Возможно, наш самый важный текст года. Черновик именно этого расследования Иван Голунов сдал перед своим задержанием. Пока Иван находился под арестом, текст помогали доделывать 15 журналистов из 7 СМИ. Этот текст опубликовали десятки изданий, включая зарубежные. Если вы пропустили эту историю, сейчас идеальное время, чтобы с ней ознакомиться.

#медуза2019",1578264332
221,"Путеводитель по русофобии от «сволочей русофобских», как нас ласково называют некоторые читатели

#медуза2019",1578260732
183,Финал молодежного чемпионата мира по хоккею завершился со счетом 4:3 в пользу Канады.,1578257132
138,"Правительство Венесуэлы сместило лидера оппозиционного парламента страны Хуана Гуайдо. Его место занял депутат, обвиняемый в коррупции",1578254073
94,"Во французском городе Мец полицейские ранили мужчину с ножом, бросившего на них с криком «Аллаху акбар»",1578252034
427,"Иран объявил о полном выходе из ядерной сделки, заключенной в 2015 году между иранскими властями и шестью странами-посредниками",1578249632
192,"Парламент Ирака проголосовал за изгнание иностранных войск из страны. Но 160 парламентариев, в основном из числа курдов и суннитов, на голосование не пришли.",1578247759
172,Российские лыжники Александр Большунов и Сергей Устюгов заняли первые два места в общем зачете многодневной гонки «Тур де Ски»,1578245460
143,Получилось в стиле Дзюбы,1578243060
554,"Сегодня умер онколог Андрей Павленко, у которого в 2018 году диагностировали рак желудка. Вспоминаем о том, как он боролся со своей болезнью и поддерживал других людей с онкологическими заболеваниями",1578240660
112,"«Медуза»подводит итоги десятилетия в космонавтике: китайцы на Луне, почти достроенная МКС, выход в межзвездное пространство, самая большая антенна телескопа (российская) и ракеты Илона Маска.",1578238566
78,"Мужчина представился охране сотрудником ФСБ, а, когда его начали досматривать, схватил сумку с оружием и убежал",1578232597
598,"Суд в США обязал порностудию выплатить почти 13 миллионов долларов 22 женщинам, которые заявили, что их обманом заставили сниматься в порнофильмах. Женщины утверждают, что перед подписанием контрактов им угрожали, некоторым давали алкоголь и наркотики. Студия обещала, что фильмы с их участием получат только коллекционеры, но на деле ролики опубликовали на крупнейших порносайтах. После случившегося женщины подверглись травле, некоторые пытались покончить с собой",1578228887
460,"Прошедшие 10 лет показали, что история России теперь пишется в судах. Журналист «Медиазоны» Максим Литаврин рассказывает о 30 знаковых процессах десятилетия.",1578225013
159,"В центре Петербурга возле одного из баров собрались около 20 человек, которые жгли файер, взрывали дымовые шашки и, по словам очевидцев, выкрикивали приветствия в адрес Гитлера",1578222319
325,"Получается, Ивану Урганту заплатите чеканной монетой",1578219919
140,"Во Владивостоке 30 автомобилей провалились под лед. По одной из версий, это случилось после того, как рыбаки просверлили несколько лунок в месте, где стояли машины, чтобы проверить толщину льда.",1578217519
73,"Кулдига — латвийский Брюгге: почему туда надо ехать за Средневековьем и чем знаменит местный водопад? Куда сходить в Даугавпилсе, кроме музея Марка Ротко? В подкасте «Лаби!» редакция «Медузы» рекомендует места, куда можно съездить в праздники. И это не только Старая Рига или юрмальский берег.
 
Подписывайтесь на подкаст, «Лаби!» есть на всех основных платформах:

Apple Podcasts
Google Podcasts 
CastBox
Spotify
Яндекс.Музыка 
Букмейт",1578215119
250,«Медуза» изучила историю расследовательской журналистики за десять лет в России: от традиционных текстов в известных СМИ до первых антикоррупционных блогеров и новых медиа. Мы отобрали главные расследования десятилетия — по одному на каждый год.,1578212719
825,"Умер хирург-онколог из Петербурга Андрей Павленко, у которого в 2018 году диагностировали рак желудка. Последние два года он вел подкаст и видеодневник на сайте «Такие дела», где рассказывал о лечении онкологических заболеваний в России и о том, как борется с болезнью.",1578210311
254,"Дональд Трамп пригрозил Ирану, что США атакуют цели, важные для иранской культуры, если Тегеран попробует ударить по американцам",1578208707
431,"Средние зарплаты в 2700 долларов к 2020 году, избавление от нефтяной зависимости и лидерство в высоких технологиях. Вспоминаем, каким видели будущее страны 10 лет назад и что в ее развитии пошло не так.",1578205804
146,"В 2019 году исполнилось 220 лет со дня рождения Александра Пушкина. К той дате мы сделали игру, в которой Пушкин описывает вашу жизнь. Но в принципе гадать на его текстах можно и в новогодние праздники. 

#медуза2019",1578191217
537,"Полезнейшая инструкция от «Команды 29», прочитав которую, вы будете знать, на что имеет право полицейский и что делать, если ваши права нарушают. 

#медуза2019",1578187617
58,"Разумеется, подкаст «Книжный базар» в 2019 году не мог пройти мимо Виктора Пелевина — писателя, по которому можно сверять часы (и о котором всегда увлекательно спорить). 

#медуза2019",1578184017
326,"Нет, нам не стыдно за этот тест 🎼🎶

#медуза2019",1578180417
119,"31 июля 2018 года в Центральноафриканской Республике были убиты российские журналисты Орхан Джемаль, Александр Расторгуев и Кирилл Радченко — они собирались снять документальный фильм о российских ЧВК в Африке. Согласно официальной версии, их убили и ограбили местные повстанцы. Но независимые расследователи в это не верят.

В этом выпуске подкаста Елена Ванина, Полина Еременко и Илья Жегулев рассказывают истории каждого из трех погибших

#медуза2019",1578176817
262,"Одним из самых важных законов, принятых в 2019 году, стал закон, позволяющий признавать «иностранными агентами» обычных граждан России. Будьте осторожны 

#медуза2019",1578173217
75,"В Тюменской области легковой автомобиль столкнулся с грузовиком. Погибли мать, отец и трое детей, которые находились в легковушке",1578169617
194,"Ракета взорвалась на площади возле посольства США в Багдаде. Также атаке подверглась иракская военная база, где расквартированы американцы. О погибших не сообщается",1578166017
186,Россия обыграла Швецию со счетом 5:4 и оказалась в финале молодежного чемпионата мира по хоккею,1578162417
160,"В день атаки на иранского генерала Касема Сулеймани в США возросло количество поисковых запросов, связанных с военным призывом, и третьей мировой войной. Сайт американской призывной службы вышел из строя",1578161841
83,"Структура «Альфа-групп» Михаила Фридмана выкупила долг Виктора Батурина в 3,2 миллиарда рублей. И, кажется, намерена взыскать его с сестры Виктора, Елены Батуриной — богатейшей женщины России.",1578156293
92,Белоруссия купила первую в 2020 году партию российской нефти. Со скидкой,1578153893
86,"Мы знаем, что каникулы уже надоели. Но еще мы знаем, что с этим делать. Вот здесь можно залипнуть надолго.",1578151493
428,"В Омске прошел митинг из-за смерти местного жителя Дмитрия Федорова. Он погиб под колесами электрички после рассказа о подброшенных наркотиках. Официальная причина смерти Федорова — суицид, но близкие погибшего в это не верят.",1578149093
96,"Bloomberg рассказал о подготовке атаки на иранского генерала Касема Сулеймани. Оказывается, об планах убить его даже в Белом доме знали не все",1578146693
81,"В конце декабря «Медуза» попросила читателей рассказать, что хорошего и важного произошло с ними за последние десять лет. Мы получили много отличных историй и публикуем лучшие с незначительными редакторскими правками.",1578144293
163,"Похороны влиятельного иранского генерала Касема Сулеймани, который был убит в Ираке по приказу президента США",1578141893
143,"«Холоп» стал 13-м по счету российским фильмом, которому удалось преодолеть планку в миллиард рублей по кассовым сборам",1578139493
99,Условно-бесплатный онлайн-шутер Fortnite второй год подряд показывает самую высокую прибыль среди видеоигр,1578137093
542,"По просьбе «Медузы» кандидат политических наук Иван Григорьев из НИУ ВШЭ (Санкт-Петербург) отрецензировал шесть книг передовых западных мыслителей, которые с разной степенью успеха пытаются объяснить произошедшие за последние десять лет глобальные изменения в политике и экономике. Спойлер: все плохо, будет хуже, а если вам показалось, что где-то относительно терпимо, то это временная иллюзия. Счастливого нового десятилетия!",1578134693
42,"Компания «Гражданские самолеты Сухого» подала к авиакомпании «ИрАэро» иск на 941 миллион рублей. До этого производитель SSJ 100 уже дважды пытался судиться с «ИрАэро», но отзывал свои иски",1578132293
378,"Главные политические события последних десяти лет, от Болотной через «бешеный принтер», Крым и губернаторов-«технократов» до Шиеса и «московского дела». Как система, построенная Владимиром Путиным на первых сроках, начала давать сбой — но устояла. Рассказывает политический обозреватель «Медузы» Андрей Перцев",1578129893
168,"«Мы предприняли действия, чтобы остановить войну, а не чтобы ее начать», — заявил Дональд Трамп об убийстве иранского генерала",1578127493
291,"10 лет в Рунете:
— он стал почти повсеместно доступным, дешевым и скоростным
— но и рекордно несвободным из-за новых законов и запретов
— интернет победил телевидение по доходам от рекламы
— но телевизор все еще смотрят больше, чем ютьюб
— триллионы рублей потрачены на импортозамещение и захват мировых рынков
— но эффект от этого пока неочевиден
— расцвела стартап-индустрия
— а потом сжалась
— российские IT-проекты вышли на западные биржи
— а потом вернулись
И так далее в обзоре «Медузы»",1578125093
97,"Проверьте, как хорошо вы помните современную историю России — от Августовского путча до Чемпионата мира по футболу

#медуза2019",1578119682
147,"Рассказывая о приходе западного фастфуда в СССР, обычно вспоминают открытие «Макдоналдса» на Пушкинской в 1990 году. Или Pizza Hut, в рекламе которого снимался Михаил Горбачев. На самом деле их опередила пиццерия Astro Pizza, которую в 1987 году открыло советско-американское предприятие «Диалог». Из него, в свою очередь, вырос инвестиционный банк «Тройка Диалог» — будущий создатель системы офшоров для самых влиятельных людей России.

#медуза2019",1578112482
