likes,body,time
23,"Первые случаи заражения коронавирусом зафиксированы в Европе, власти Франции сообщили о двух заболевших - в Бордо и Париже.",1579955576
46,"Литературный критик Галина Юзефович рассказывает о книге Патрисии Данкер «Джеймс Миранда Барри». В основе сюжета — реальная история английского врача, который был женщиной и всю жизнь скрывал свой пол.",1579953176
77,"Клим Шипенко, получая ""Золотого орла"" за фильм ""Текст"", попросил нового министра культуры Ольгу Любимову не штрафовать Сергея Дворцевого, попавшего с фильмом «Айка» в список должников. «Режиссер не виноват», - сказал Шипенко.",1579950776
48,"На востоке Турции вечером 24 января произошло землетрясение магнитудой 6,8. Эпицентр землетрясения находился в провинции Элязыг. По последним данным, погиб 21 человек, более 1000 пострадали. Спасатели продолжают разбор завалов в поисках погибших и выживших.",1579948376
130,"Наш подкаст про финансовую грамотность «Калькулятор» вернулся с каникул! Первый выпуск — для ленивых инвесторов (а точнее для тех, кто вроде и не против начать инвестировать, но им как-то лень). Для таких есть готовые стратегии в формате «бери и делай».",1579945976
150,"Суд назначил Бочкаревой судебный штраф в 30 тысяч рублей и прекратил уголовное дело. Вероятно, такое решение было принято, потому что актриса сделала пожертвование в благотворительный фонд. Разбираем, насколько это распространенная практика, и рассказываем, что делать, если обвиняют в хранении наркотиков.",1579943576
110,Можно ли принимать БАДы? Или достаточно есть побольше морепродуктов? Отвечаем на вопросы об омеге-3.,1579941176
39,На этих выходных предстоит сделать сложный выбор: «Барашек Шон» или «Олдбой»? О лучших фильмах недели читайте в нашей подборке.,1579938776
94,"Директор Центра политической конъюнктуры Алексей Чеснаков, близкий к Суркову, заявил, что помощник президента покинул пост из-за ""смены курса на украинском направлении"".",1579932932
488,В китайском городе Ухань экстренно строят временную больницу на тысячу койко-мест. Уже 3 февраля ее планируют сдать в эксплуатацию. Вот как это выглядит:,1579911711
211,"Число жителей России в 2019 году уменьшилось на 35,6 тысячи человек. 

На 1 января 2020 года в России, согласно Росстату, жили 146 миллионов 745,1 тысячи человек, а годом ранее — 146 миллионов 780,7 тысячи.",1579909911
65,"Алексей Бурков согласился с тем, что занимался мошенничеством, кражей личных данных и отмыванием денег",1579908111
104,...,1579906311
71,"Имущество торгового дома «Интерторг», владеющего сетью супермаркетов Spar в Санкт-Петербурге и ряде регионов на северо-западе России, арестовали в качестве обеспечительной меры по иску Сбербанка ",1579904511
61,"«Facebook будет работать над тем, чтобы Трамп переизбрался, а Трамп защитит Facebook», — считает Сорос. Каких-либо аргументов в пользу этой теории милилардер не приводит",1579902711
161,🤷‍♂️,1579900911
35,"Александра Винника обвиняют в мошенничестве в сфере компьютерной информации. 

По словам его греческого адвоката Зои Константопулу, Винника экстрадирован из Греции во Францию. 

Константопулу называет произошедшее похищением, а не экстрадицией",1579899111
84,"По словам пресс-секретаря президента Дмитрия Пескова, в Кремле не в курсе ситуации.",1579897311
154,🎩🎖️,1579895511
255,Глава Чувашии заставил пожарного подпрыгивать за ключами от новой служебной машины. Теперь подпрыгивают все,1579893711
82,"В пятом эпизоде англоязычного подкаста The Naked Pravda шеф-редактор международной версии «Медузы» Кевин Ротрок обсуждает с западными исследователями, как возникают теории заговора и почему многие охотно в них верят.",1579891911
158,Следующий шаг — приготовить в космосе пиццу с ананасами,1579890111
161,"Режиссеру Андрею Звягинцеву пришлось отказаться от съемок фильма, потому что от него требовали поменять финал.",1579888311
201,Мумия говорит mp3 скачать все альбомы,1579886511
119,"Основатель и лидер «Базы» использует псевдонимы Норманнское копье и Римский волк. Издание The Guardian выяснило, что под ними скрывается 46-летний американец с итальянскими корнями Ринальдо Наззаро, который живет в России и может быть связан с российскими властями.",1579884711
196,Как Кремль готовится к голосованию по Конституции.,1579882911
318,"Утром 24 января водитель «КамАЗа» перекрыл движение по Бауманской улице в Москве. Он протестовал против задержек зарплаты и говорил, что у него семеро детей и ему нечем их кормить.",1579881111
137,Когда-нибудь роботы перестанут это терпеть,1579879311
160,"Антон Долин — о новом фильме Греты Гервиг, получившем шесть номинаций на «Оскар»",1579877507
194,"По данным Baza, ряд чиновников мэрии Москвы и высокопоставленных силовиков получили в собственность квартиры в первом доходном доме города в Большом Николоворобинском переулке.

Предполагалось, что жилье в этом доме будут сдавать в аренду, для пополнения московского бюджета. Издание отмечает, что купить эти квартиры по рыночным ценам чиновники не могли.",1579875708
925,В китайском городе Ухань экстренно строят временную больницу на тысячу койко-мест. Уже 3 февраля ее планируют сдать в эксплуатацию. Вот как это выглядит:,1579873967
74,Стрелка удалось задержать,1579872107
75,"Михаил Мишустин сформировал новое правительство 21 января, но у нас есть игра, в которой вы все еще можете успеть стать министром...чего-нибудь.

Предупреждаем: будет непросто",1579870894
121,Пока что лучший флешмоб 2020-го,1579869094
298,"Мэр Москвы Сергей Собянин признал, что в районе строительства Юго-Восточной хорды находятся пятна радиоактивного заражения, о чем ранее говорил экоактивисты.  ",1579867294
160,"Что известно (и неизвестно) о новом коронавирусе 2019-nCoV, который продолжает распространяться в Юго-Восточной Азии:",1579865494
276,Это все мы,1579863694
85,"«Все-таки у нас есть российские законы, и они должны исполняться»",1579861893
81,Импортозамещение,1579860093
83,Инвесторы приготовились,1579858293
72,"Какие российские приложения станут обязательными для предустановки на телефоны, планшеты, компьютеры? 

Отвечает Федеральная антимонопольная служба России",1579856493
62,"Australian Open уже в самом разгаре, а значит, самое время освежить свои знания о теннисе. Для начала, например, вспомнить, какого цвета мяч!

Это партнерский тест",1579854693
67,"По данным «Коммерсанта», основатель и владелец компании Faberlic Алексей Нечаев возглавит новую партию праволиберального толка. У нее пока нет названия, первый съезд намечен на 1 марта.

В планах у партии участие в выборах в 20 регионах России в 2020 году, а в 2021-м — в выборах в Госдуму",1579853425
514,"Что происходит в 11-миллионном городе, блокированном из-за вируса",1579851625
182,Общее число заболевших превысило 830 человек.,1579849825
416,Скучали? ,1579848025
63,"Все закончилось тем, что стрелявший мужчина сдал оружие. Он требовал, чтобы его пропустили в офис бывшего президента. В результате никто не пострадал.",1579846583
88,"По информации Znak.com, двое 14-летних школьников из закрытого города Снежинск Челябинской области, возможно, планировали взрыв в школьной столовой.",1579845110
85,"Спустя неделю в Tilda признали, что служба модерации превысила свои полномочия. Создатели сайта о «ростовском деле» заявили, что на этом конфликт с сервисом исчерпан",1579842710
200,"«Дылда» также была отмечена призами за лучшую режиссерскую, операторскую работу и лучшую работу художника.",1579840310
340,«Победе» менее выгодно заправляться в базовом аэропорту компании — Внуково — чем в других странах. Даже с учетом скидок за большие объемы,1579837910
92,"Многодетная мама из города Кудымкар 23 января задушила детей, а затем попыталась покончить с собой, но ее спасли.",1579835510
277,Самые быстрые большие пальцы на Диком Западе,1579833110
42,"С 23 января в России ограничен доступ к нидерландскому зашифрованному почтовому сервису StartMail. В ФСБ сообщили, что с адресов StartMail рассылались сообщения об угрозах взрывов в 16 регионах России. ",1579830710
252,"Соседями России по рейтингу стали Кения, Папуа-Новая Гвинея, Парагвай и Уганда.",1579828310
120,"В этой статистике не учитывались данные о людях, проживающих в Крыму, а также на территориях Луганской и Донецкой областей",1579825910
251,"«Мы не боремся с наличием самих камер, которые просто стоят и пишут, а мы боремся с тем, что на камерах точно можно отличить, что вы — это вы, идете к конкретной точке, в конкретное время», — пояснила Попова",1579824110
108,"«У нас тесные рабочие отношения с нашими украинскими партнерами, и мы не хотим их обижать», — сказал Хейдон.",1579822310
359,Если свидание оказалось неудачным,1579820510
318,🤔🤔🤔,1579818710
164,Видеодизайнер «Медузы» Андрей Першин анимировал настенные панно на улицах Ижевска — в том числе мозаику на здании «Удмуртэнерго» и рисунки на стенах бывшего «Детского мира» и центрального автовокзала,1579816910
187,Как легко собрать инвестиционный портфель — рассказывают ведущие подкаста «Калькулятор». Самый простой вариант в России — открыть индивидуальный инвестиционный счет и купить государственные облигации. Но есть и другие варианты.,1579815109
1259,"«Сегодня мы, граждане Российской Федерации, заявляем, что на наших глазах в стране происходит конституционный переворот. Мы уверены, что цель этого переворота — пожизненное сохранение у власти Владимира Путина и его коррумпированного режима. Для этого придумана спецоперация по незаконному переписыванию Конституции». Так начинается «манифест граждан России», опубликованный в «Новой газете». ",1579813309
90,Почему — в компании не объяснили.,1579811509
348,Кто-то сомневался?,1579809709
131,"Всемирная организация здравоохранения считает, что новый вирус в Китае — это ЧП пока только для самого Китая, а не для всего мира",1579807909
94,"В пятом эпизоде подкаста «Истории кино» кинокритики Антон Долин и Владимир Захаров обсуждают азиатские фильмы. Ведущие выясняют, как Венецианский фестиваль открыл западному зрителю Азию, почему «Джон Уик» — это типичный гонконгский боевик и почему в японских ужастиках нет почти ничего японского. ",1579807643
100,"Кто покупатель, неизвестно",1579805843
222,"В 2019 году в России были проданы 192 Rolls-Royce и 142 Lamborghini. Это вдвое больше, чем годом раньше",1579804043
49,Аркадий Волож объяснил продажу небольшой части своих акций «Яндекса»,1579802243
266,"До глобальной катастрофы осталось 100 секунд (ну, не буквально)",1579800443
211,"Страны с «особой ответственностью за цивилизацию» по версии Путина: 

Россия
Китай
США
Франция
Великобритания 

Страны без «особой ответственности за цивилизацию» по версии Путина: 

Все остальные.",1579799482
112,Хаха!,1579797682
136,Ну все. Или еще нет?,1579795882
794,"Что происходит в 11-миллионном городе, блокированном из-за вируса",1579794126
132,"«[Иссахар] считает, что обращения мамы и руководства Израиля достаточно», — сказала уполномоченный по правам человека Татьяна Москалькова",1579792282
81,Juice Wrld умер 8 декабря в Чикаго. Официальная причина смерти — случайная передозировка оксикодона и кодеина,1579790481
329,"Фермер Влад Балашов уже 30 лет живет в Австралии. Свои владения он называет Балашихой. Его дом стал убежищем для вомбатов, кенгуру и ехидн, которые укрываются там от пожаров",1579788681
131,"Население Хуангана — 7,5 миллиона человек. С этим городом прервано железнодорожное и автобусное сообщение — как и с Эчжоу, расположенным неподалеку.",1579786881
100,"В 2018 году Андрей Белоусов был одним из авторов «майского указа», согласно которому российская экономика должна стать пятой в мире. Предыдущее правительство с этой задачей не справилось, и теперь Белоусов, став первым вице-премьером, будет решать ее сам.

Кто он такой, что именно ему нужно сделать и есть ли у него шансы на успех (спойлер: вряд ли):",1579785081
274,"Премьера на «Медузе» Журналистка Катерина Гордеева выпустила фильм «Афган. Человек (не) вернулся с войны» — историю советских солдат, которые вернулись с войны в Афганистане, но так и не смогли прекратить воевать — теперь уже в своей собственной стране",1579783281
89,Будьте здоровы!,1579781481
229,Главное — это найти себя,1579779681
157,"Как выглядит сейчас Ухань — город, откуда началось распространение нового типа коронавируса:",1579777881
206,"На китайскую провинцию Хубэй приходятся все 17 зафиксированных к 23 января смертей от нового коронавируса. Из административного центра региона — города Ухань — запрещен выезд, закрыты все аэропорты и железнодорожные станции. Граничащая с Китаем Амурская область объявила режим повышенной готовности",1579776561
132,"Владимир Путин встретился в Израиле с матерью Наамы Иссахар, которая была осуждена в России на семь с половиной лет колонии за контрабанду гашиша. 

Ожидалось, что Путин объявит о помиловании Иссахар.",1579774761
251,"Передача украинских железных дорог в управление Deutsche Bahn, по словам премьер-министра Алексея Гончарука, «должна показать, что Украина беспрецедентно открыта для инвестиций, для мира, для новых стандартов».",1579772961
129,"Депутаты Госдумы приняли в первом чтении законопроект о поправках в Конституцию, предложенный Путиным. «За» проголосовали 432 человека, против не выступил никто.",1579771161
464,"49-летняя сестра премьера Мишустина, Наталия Стенина, владеет недвижимостью в Москве и Подмосковье, общая стоимость которой превышает один миллиард рублей. Это, в частности, квартира площадью более 170 квадратных метров в Хамовниках и дом и земельный участок в в коттеджном поселке Agalarov Estate.",1579769361
61,"iPad компактный, но при этом может полностью заменить рабочий компьютер. Вот несколько примеров, как это бывает. Это промо",1579767561
52,"Двум министрам из правительства Медведева нашли новую работу. Максим Топилин возглавил Пенсионный фонд, Вероника Скворцова стала руководителем Федерального медико-биологического агентства",1579766210
699,"Новый министр культуры Ольга Любимова после назначения скрыла свои записи в блоге kropalik в «Живом журнале» — в частности, пост от 2008 года, на который обратили внимание СМИ и блогеры.

В нем Любимова признается, что она «ни хрена не культурный человек» и не любит оперу, балет, классическую музыку и музеи.",1579764409
506,"Куда именно уехал Долгополов, пока неизвестно",1579762609
169,"«Сам Габышев закрылся в доме, сотрудники полиции предприняли попытку взломать дверь, но после его предупреждения о вызове адвоката отказались от этой идеи», — рассказал координатор «Правозащиты Открытки» Алексей Прянишников.",1579762195
90,Вот какие российские приложения ФАС предлагает предустанавливать на гаджеты,1579758101
115,🍅🥔🥕🍎🍌,1579754500
101,"Матвиенко подчеркнула, что «речь должна идти не об „охоте на ведьм“, а о надежном обеспечении суверенитета России, устранении малейших лазеек для вмешательства во внутренние дела нашей страны»",1579750900
622,134-е место в «Индексе демократии» Россия делит с республикой Конго.,1579747300
